{
  "schema": "earthship-sensor-registry/v1",
  "environment": "simulation",
  "application_id": "11111111-1111-4111-8111-111111111111",
  "devices": [
    {
      "device_id": "0000000000000001",
      "sensor_id": "opening_01",
      "name": "Commissioning opening 01",
      "location": "Unassigned",
      "zone": "unassigned",
      "device_type": "window",
      "transport": "lorawan",
      "manufacturer": "Milesight",
      "model": "WS301",
      "decoder": "milesight_ws301/v1",
      "capabilities": [
        "contact_state",
        "battery",
        "radio_health",
        "tamper"
      ],
      "observation_types": [
        "contact_state",
        "tamper"
      ],
      "units": {
        "contact_state": "state",
        "tamper": "boolean"
      },
      "enabled": true,
      "hardware_epoch": "f8977c55-15f9-5bfc-ae4c-19658ccb49db",
      "radio_verified": false,
      "state_stale_seconds": 120,
      "communication_stale_seconds": 120,
      "offline_seconds": 300,
      "battery_low_percent": 20,
      "battery_low_volts": 2.7,
      "security_policy": null
    },
    {
      "device_id": "0000000000000002",
      "sensor_id": "opening_02",
      "name": "Commissioning opening 02",
      "location": "Unassigned",
      "zone": "unassigned",
      "device_type": "skylight",
      "transport": "lorawan",
      "manufacturer": "Milesight",
      "model": "WS301",
      "decoder": "milesight_ws301/v1",
      "capabilities": [
        "contact_state",
        "battery",
        "radio_health",
        "tamper"
      ],
      "observation_types": [
        "contact_state",
        "tamper"
      ],
      "units": {
        "contact_state": "state",
        "tamper": "boolean"
      },
      "enabled": true,
      "hardware_epoch": "433d6bb2-d3f2-58a6-bed8-fd95a4089ebd",
      "radio_verified": false,
      "state_stale_seconds": 120,
      "communication_stale_seconds": 120,
      "offline_seconds": 300,
      "battery_low_percent": 20,
      "battery_low_volts": 2.7,
      "security_policy": null
    },
    {
      "device_id": "0000000000000003",
      "sensor_id": "opening_03",
      "name": "Commissioning opening 03",
      "location": "Unassigned",
      "zone": "unassigned",
      "device_type": "door",
      "transport": "lorawan",
      "manufacturer": "Milesight",
      "model": "WS301",
      "decoder": "milesight_ws301/v1",
      "capabilities": [
        "contact_state",
        "battery",
        "radio_health",
        "tamper"
      ],
      "observation_types": [
        "contact_state",
        "tamper"
      ],
      "units": {
        "contact_state": "state",
        "tamper": "boolean"
      },
      "enabled": true,
      "hardware_epoch": "4c03430a-e8b3-582f-8180-268b504bb854",
      "radio_verified": false,
      "state_stale_seconds": 120,
      "communication_stale_seconds": 120,
      "offline_seconds": 300,
      "battery_low_percent": 20,
      "battery_low_volts": 2.7,
      "security_policy": null
    },
    {
      "device_id": "0000000000000004",
      "sensor_id": "opening_04",
      "name": "Commissioning opening 04",
      "location": "Unassigned",
      "zone": "unassigned",
      "device_type": "window",
      "transport": "lorawan",
      "manufacturer": "Milesight",
      "model": "WS301",
      "decoder": "milesight_ws301/v1",
      "capabilities": [
        "contact_state",
        "battery",
        "radio_health",
        "tamper"
      ],
      "observation_types": [
        "contact_state",
        "tamper"
      ],
      "units": {
        "contact_state": "state",
        "tamper": "boolean"
      },
      "enabled": true,
      "hardware_epoch": "28c078d2-65ff-56a6-bed0-161d365abbf7",
      "radio_verified": false,
      "state_stale_seconds": 120,
      "communication_stale_seconds": 120,
      "offline_seconds": 300,
      "battery_low_percent": 20,
      "battery_low_volts": 2.7,
      "security_policy": null
    },
    {
      "device_id": "0000000000000005",
      "sensor_id": "opening_05",
      "name": "Commissioning opening 05",
      "location": "Unassigned",
      "zone": "unassigned",
      "device_type": "skylight",
      "transport": "lorawan",
      "manufacturer": "Milesight",
      "model": "WS301",
      "decoder": "milesight_ws301/v1",
      "capabilities": [
        "contact_state",
        "battery",
        "radio_health",
        "tamper"
      ],
      "observation_types": [
        "contact_state",
        "tamper"
      ],
      "units": {
        "contact_state": "state",
        "tamper": "boolean"
      },
      "enabled": true,
      "hardware_epoch": "4413ce39-3da3-5bbd-8f86-c54308072362",
      "radio_verified": false,
      "state_stale_seconds": 120,
      "communication_stale_seconds": 120,
      "offline_seconds": 300,
      "battery_low_percent": 20,
      "battery_low_volts": 2.7,
      "security_policy": null
    },
    {
      "device_id": "0000000000000006",
      "sensor_id": "opening_06",
      "name": "Commissioning opening 06",
      "location": "Unassigned",
      "zone": "unassigned",
      "device_type": "door",
      "transport": "lorawan",
      "manufacturer": "Milesight",
      "model": "WS301",
      "decoder": "milesight_ws301/v1",
      "capabilities": [
        "contact_state",
        "battery",
        "radio_health",
        "tamper"
      ],
      "observation_types": [
        "contact_state",
        "tamper"
      ],
      "units": {
        "contact_state": "state",
        "tamper": "boolean"
      },
      "enabled": true,
      "hardware_epoch": "c6e8c77e-5d0c-505b-9f6a-d8d1d02ba269",
      "radio_verified": false,
      "state_stale_seconds": 120,
      "communication_stale_seconds": 120,
      "offline_seconds": 300,
      "battery_low_percent": 20,
      "battery_low_volts": 2.7,
      "security_policy": null
    },
    {
      "device_id": "0000000000000007",
      "sensor_id": "opening_07",
      "name": "Commissioning opening 07",
      "location": "Unassigned",
      "zone": "unassigned",
      "device_type": "window",
      "transport": "lorawan",
      "manufacturer": "Milesight",
      "model": "WS301",
      "decoder": "milesight_ws301/v1",
      "capabilities": [
        "contact_state",
        "battery",
        "radio_health",
        "tamper"
      ],
      "observation_types": [
        "contact_state",
        "tamper"
      ],
      "units": {
        "contact_state": "state",
        "tamper": "boolean"
      },
      "enabled": true,
      "hardware_epoch": "45b5c752-be5f-596c-9ed8-7ee094cc503f",
      "radio_verified": false,
      "state_stale_seconds": 120,
      "communication_stale_seconds": 120,
      "offline_seconds": 300,
      "battery_low_percent": 20,
      "battery_low_volts": 2.7,
      "security_policy": null
    },
    {
      "device_id": "0000000000000008",
      "sensor_id": "opening_08",
      "name": "Commissioning opening 08",
      "location": "Unassigned",
      "zone": "unassigned",
      "device_type": "skylight",
      "transport": "lorawan",
      "manufacturer": "Milesight",
      "model": "WS301",
      "decoder": "milesight_ws301/v1",
      "capabilities": [
        "contact_state",
        "battery",
        "radio_health",
        "tamper"
      ],
      "observation_types": [
        "contact_state",
        "tamper"
      ],
      "units": {
        "contact_state": "state",
        "tamper": "boolean"
      },
      "enabled": true,
      "hardware_epoch": "edc16917-c2fd-598a-b5c2-e21d4a7c8d15",
      "radio_verified": false,
      "state_stale_seconds": 120,
      "communication_stale_seconds": 120,
      "offline_seconds": 300,
      "battery_low_percent": 20,
      "battery_low_volts": 2.7,
      "security_policy": null
    },
    {
      "device_id": "0000000000000009",
      "sensor_id": "opening_09",
      "name": "Commissioning opening 09",
      "location": "Unassigned",
      "zone": "unassigned",
      "device_type": "door",
      "transport": "lorawan",
      "manufacturer": "Milesight",
      "model": "WS301",
      "decoder": "milesight_ws301/v1",
      "capabilities": [
        "contact_state",
        "battery",
        "radio_health",
        "tamper"
      ],
      "observation_types": [
        "contact_state",
        "tamper"
      ],
      "units": {
        "contact_state": "state",
        "tamper": "boolean"
      },
      "enabled": true,
      "hardware_epoch": "95001ce4-8edd-5905-9860-dc998ef8a863",
      "radio_verified": false,
      "state_stale_seconds": 120,
      "communication_stale_seconds": 120,
      "offline_seconds": 300,
      "battery_low_percent": 20,
      "battery_low_volts": 2.7,
      "security_policy": null
    },
    {
      "device_id": "000000000000000a",
      "sensor_id": "opening_10",
      "name": "Commissioning opening 10",
      "location": "Unassigned",
      "zone": "unassigned",
      "device_type": "window",
      "transport": "lorawan",
      "manufacturer": "Milesight",
      "model": "WS301",
      "decoder": "milesight_ws301/v1",
      "capabilities": [
        "contact_state",
        "battery",
        "radio_health",
        "tamper"
      ],
      "observation_types": [
        "contact_state",
        "tamper"
      ],
      "units": {
        "contact_state": "state",
        "tamper": "boolean"
      },
      "enabled": true,
      "hardware_epoch": "667523a3-272d-51cf-a065-0fc130cd65eb",
      "radio_verified": false,
      "state_stale_seconds": 120,
      "communication_stale_seconds": 120,
      "offline_seconds": 300,
      "battery_low_percent": 20,
      "battery_low_volts": 2.7,
      "security_policy": null
    },
    {
      "device_id": "000000000000000b",
      "sensor_id": "opening_11",
      "name": "Commissioning opening 11",
      "location": "Unassigned",
      "zone": "unassigned",
      "device_type": "skylight",
      "transport": "lorawan",
      "manufacturer": "Milesight",
      "model": "WS301",